{
  "contractVersion": "v1alpha3",
  "centralVersion": "0.0.0-arh.3.2.1",
  "supportedContractVersions": [
    "v1alpha1",
    "v1alpha3"
  ],
  "minimumDesktopVersion": "0.0.0-dcf.1.0",
  "minimumCoreVersion": "0.0.0-dcf.1.0",
  "features": [
    "configuration_snapshot",
    "package_document",
    "fixed_permissions",
    "enterprise_identity",
    "managed_device_trust",
    "manual_device_enrollment",
    "enterprise_model_gateway",
    "enterprise_model_prompt_cache_v1alpha3"
  ],
  "maintenanceStatus": "available",
  "configurationSchemaVersions": [
    "v1alpha1"
  ]
}

